{
  "schema_version": "1.0",
  "projection_revision": "projection_fixture_001",
  "events": [
    {
      "event_reference": "event_fixture_001",
      "occurrence_reference": "occurrence_fixture_001",
      "source_reference": "source_fixture_001",
      "provider_revision": "revision_fixture_007",
      "display_text": "Customer review",
      "starts_at": "2026-08-24T09:00:00+09:00",
      "ends_at": "2026-08-24T10:00:00+09:00",
      "all_day": false,
      "time_zone": "Asia/Seoul",
      "status_code": "confirmed",
      "disclosure_code": "summary_visible",
      "truth_status_code": "observed",
      "observed_at": "2026-08-21T00:00:00Z"
    }
  ],
  "next_cursor": null
}
